#id	warrant0	warrant1	correctLabelW0orW1	reason	claim	debateTitle	debateInfo
9975147_345_A34QZDSTKZ3JO9	scholarships would give women a chance to study	scholarships would take women from the home	0	Miss America gives honors and education scholarships.	Miss America is good for women	There She Is, Miss America	In 1968, feminists gathered in Atlantic City to protest the Miss America pageant, calling it racist and sexist. Is this beauty contest bad for women?
3651490_320_A104V8NZIQFN2F	professors are even more inflexible and indoctrinate students to their personal beliefs	professors are flexible and indoctrinate students to the power of choice	1	I found online courses to not be well designed, flexible, or conducive to discussion.	Online classes are not the best way to teach	Can Young Students Learn From Online Classes?	Online courses are increasingly common in high schools and middle schools. Is this the best way to teach that age group?
5445948_307_A247LJDZOGXJK6	that harms the company's bottom line	that helps the company's bottom line	1	Interns are replacing employees.	Unpaid internship exploit college students	Do Unpaid Internships Exploit College Students?	Should the government get tough to protect unpaid interns, or are internships a win-win?
5477096_432_A34QZDSTKZ3JO9	picking teams encourages competitiveness	picking teams is not the way the system works	1	If home schooled children get to pick a high school sports team high school kids will want to be able to play for other schools.	Home-schoolers should not play for high school teams	Should Home-Schoolers Play for High School Teams?	Home-schoolers may not want their children in the classroom but they'd like to see them on the football field. Is that their right?
13303812_159_A2GHGJP29KRWOQ	most people don't understand that natural does not mean healthy	most people understand that natural does not mean healthy	0	Labeling a product with "natural" is an attempt to portray the food as "healthy", but is often not the case.	Restrict use of the word "natural" on food labels	What Makes 'Natural' Natural?	Should the F.D.A. restrict use of the word "natural" on food labels?
3526042_138_A3TKD7EJ6BM0M5	fewer tourists at attractions is best for New Yorkers	fewer tourists at attractions is not best for New Yorkers	1	The parking problems caused by the bike lanes are ruining attractions.	New York's bike lanes are not working	Are New York's Bike Lanes Working?	Mayor Koch's bicycle network died quickly. Mayor Bloomberg's is remaking the streets of the city. What is the verdict so far?
5475504_203_AE861G0AY5RGT	there is no prejudice that needed to be overcome as a home schooled student	there are prejudices that need to be overcome as a home schooled student	1	If they play for high school team maybe they can overcome the prejudice of being home schooled.	Home-schoolers should play for high school teams	Should Home-Schoolers Play for High School Teams?	Home-schoolers may not want their children in the classroom but they'd like to see them on the football field. Is that their right?
6022328_10_A1CF6U3GF7DZEJ	vegans can't figure out how to eat without being at risk	vegans can figure out how to eat without being at risk	0	Humans are naturally omnivorous, as dictated by our physiological needs, and veganism is a health risk.	Veganism is not good for everyone	Is Veganism Good For Everyone?	Maybe some of us simply weren't built to be vegans. Is the diet good for everyone?
10396017_407_A1CF6U3GF7DZEJ	we really don't that many tradespeople	we really need more trades people	1	It can provide more vocational training which will better prepare students to handle their future jobs better.	High school should last six years	Should High School Last Six Years?	President Obama recently visited a six-year high school, highlighting it as a model for the rest of the U.S. Should it be replicated?
6953350_0_APW9F8OTJ4KXO	supporting an unappreciative country only makes the US look selfless and charitable	supporting an unappreciative country only makes the US look dumb and stingy	1	Israel doesn't appreciate what we give them.	Supporting Israel hurts	Has Support for Israel Hurt U.S. Credibility?	Is support for Israel so entrenched in American politics that the U.S. has lost credibility and influence in the Middle East?
11965227_391_A3TKD7EJ6BM0M5	a dangerous market deters children from getting involved	a regulated market deters children from getting involved	1	A regulated market has replaced an unregulated and dangerous black market.	Colorado didn't go too far with pot	Did Colorado Go Too Far With Pot?	Was the move to legalize marijuana done too quickly? Do changes need to be made to their approach?
9952573_220_A1HKYY6XI2OHO1	no one goes out to eat if they want control over what they're shoving into their mouth	people go out to eat when they want control over what they're shoving into their mouth	1	Salt shakers permit diners to control the amount of salt in their food.	Salt should have a place at the table	Should Salt Have a Place at the Table?	More restaurants have been doing without salt shakers. Some chefs say that's sensible. Some diners find it annoying.
7545952_11_A1CF6U3GF7DZEJ	I die a little but still don't mind bad tv	I mind watching bad tv	1	Reality shows cause me to die a little whenever I see them advertised even though I have watched them at times.	Reality shows are worse than other TV	Are Reality Shows Worse Than Other TV?	Is a bad reality show worse than a bad sit-com? Is a compelling one less important than a compelling scripted drama?
8832426_496_A3C9GGDXBZW62D	we need athletes to be trained for professional teams	we do not need athletes to be trained for professional teams	1	Intramural and interscholastic have a place but not college sports which just train athletes for professional teams.	Drop sports program in undergraduate schools	Dropping the Ball	Should more undergraduate schools follow in the footsteps of Spelman College and consider dropping intercollegiate sports programs?
10346152_0_A2JKETV64OU7DY	police officers have no right to privacy in many situations.	police officers also have the right to privacy in many situations.	0	Cameras should monitor police officers 24/7.	Police officers should be required to wear cameras	If Police Encounters Were Filmed	Should police officers be required to wear cameras that record their interactions with the public?
3639835_338_A3PILUAB7LZGWQ	money will be saved all the way around	money will not be saved all the way around	1	The only interest of the private sector is the bottom line profits.	Privatization is a bad deal for cities and states	Is Privatization a Bad Deal for Cities and States?	To save money, New York is turning the clock back on outsourcing by replacing private contractors with city workers.
6129077_395_A34QZDSTKZ3JO9	it's a good diet that shouldn't have to be helped with vitamins	a good diet shouldn't have to be helped with vitamins	0	Vegan options like juices and replacement items are enriched with vitamins.	Veganism is good for everyone	Is Veganism Good For Everyone?	Maybe some of us simply weren't built to be vegans. Is the diet good for everyone?
10951533_475_A1I4CYG5YDFTYM	this large economy provides boosts for the entire country's economy	this large economy doesn't provide boosts for the entire country's economy	1	They operate in such a large economy that it makes it almost impossible for smaller banks to succeed.	Big banks are out of control	Are Big Banks Out of Control?	Does the lack of legal compliance that have cost banks billions in fines show that some have gotten too big to manage properly?
4583769_0_AE861G0AY5RGT	arms sold to Taiwan are not used for defensive, but offensive purposes	arms sold to Taiwan are not used for offensive, but defensive purposes	1	There is no reason we shouldn't sell reasonable defensive arms to Taiwan.	Keep selling arms to Taiwan	Should the U.S. Keep Selling Arms to Taiwan?	The U.S. approved a $5.8 billion arms sale to Taiwan over China's protests. What are the consequences?
3176054_290_A1DJNUJZN8FE7N	the two can so easily co exist	the two hardly co exist	1	It undermines public education and emphasizes religious values over facts even though the two can easily co-exist.	Home schoolers do not deserve a tax break	Do Home Schoolers Deserve a Tax Break?	Some conservatives want a federal credit for families who teach their children at home. What are its chances in the new Congress?
7447002_600_AB98SGS280TY5	Overdramatizing simple events and names is in a way more entertaining	Overdramatizing simple events and names is in no way more entertaining	1	Reality shows fake misery, drama, and embarrassment and pretend as though it is real.	Reality shows are worse than other TV	Are Reality Shows Worse Than Other TV?	Is a bad reality show worse than a bad sit-com? Is a compelling one less important than a compelling scripted drama?
7951527_155_A1I4CYG5YDFTYM	this can be found in other buildings and online venues	this can't be found in other buildings and online venues	1	Libraries provide a venue for a number of desirable individual and shared life-enhancing activities.	We need libraries	Do We Still Need Libraries?	What are libraries for, and how should they evolve?
9831390_0_A104V8NZIQFN2F	it is NATO's fight and the US belongs to NATO	it is not NATO's fight and the US belongs to NATO	1	Not our fight.	US should not attack Syria	Is an Attack on Syria Justified?	Should the United States and its allies launch air strikes against Syria in response to the Assad regime's reported use of chemical weapons?
11894913_488_AA7ASGQEOMKEZ	a solution would encourage the search for a better solution later	a solution better than nothing would discourage the search for a better solution later	0	A ratings solution, while messy, would be better than nothing.	Government should grade colleges	Should the Government Grade Colleges?	Should the government rate colleges to hold them accountable for graduation rates, student debt and access for the poor and minorities?
2700850_221_AJNQ2PBD07FKE	They can learn critical thinking In psychology courses	They can learn critical thinking In humanities courses	1	Liberal arts provide knowledge to learn creative thinking, reading, and writing which are important to many career paths.	Colleges need humanities programs	Do Colleges Need French Departments?	With humanities programs being cut at many universities, what do students stand to lose?
7957857_673_A34QZDSTKZ3JO9	most people have internet	few people have internet	1	Libraries provide internet for those that need it to do homework, find employment, and file taxes.	We need libraries	Do We Still Need Libraries?	What are libraries for, and how should they evolve?
3122593_214_APW9F8OTJ4KXO	the bike lanes are not designed well enough to really serve their purpose and encourage biking	the bike lanes are designed well enough to really serve their purpose and encourage biking	1	One can avoid and improve heavy traffic by using public transportation or biking.	New York's bike lanes are working	Are New York's Bike Lanes Working?	Mayor Koch's bicycle network died quickly. Mayor Bloomberg's is remaking the streets of the city. What is the verdict so far?
8389640_328_A247LJDZOGXJK6	parents don't need to come first for their children	parents  need to come first for their children	1	This will cause more government interference in peoples lives relegating parents to a secondary role.	Public preschool is not a smart investment	Is Public Preschool a Smart Investment?	Would quality child care that included a preschool curriculum be a better national goal?
7046664_196_A247LJDZOGXJK6	it is bad to focus on things that are not relevant	it is fun to focus on things that are not relevant	0	The spouse opinion may not be relevant to the campaign of the president.	We don't need to hear from candidate's spouse	Do We Need to Hear From the Candidate's Spouse?	What role should spouses of the nominees play at conventions? Is it appropriate (or useful) for them to give speeches?
2653827_630_A1CF6U3GF7DZEJ	nobody can defeat the oil interests	together everybody can defeat the oil interests	1	Having such high interest in a foundling industry with the economy struggling is proof of the electric cars viability.	Electric cars will succeed	Will Electric Cars Finally Succeed?	Are plug-in cars the future, or will high cost and other technologies eclipse their promise?
11670926_107_A1DJNUJZN8FE7N	we don't want better solutions	we want better solutions	1	If race is such a big part of the economic hardships and the reasons people are denied opportunities, then economic based actions would be a better solution.	Affirmative actions should be based on income	Should Affirmative Action Be Based on Income?	Will the Supreme Court decision on race-based preferences push colleges to resort to less effective methods to promote to diversity?
10228010_160_A1HKYY6XI2OHO1	short term fixes require much effort	short term fixes require little effort	0	[They] are short term fix that quickly fades.	Casinos are too much of a gamble	Are Casinos Too Much of a Gamble?	Do the economic and fiscal benefits of casinos outweigh their social and economic costs?
5448130_383_A104V8NZIQFN2F	college students need to see how the "real world" is going to be	college students do not need to see how the "real world" is going to be	1	Internships are abused by employers and they should be monitored for misuse.	Unpaid internship exploit college students	Do Unpaid Internships Exploit College Students?	Should the government get tough to protect unpaid interns, or are internships a win-win?
7441792_159_APW9F8OTJ4KXO	other shows are held accountable via ratings and reviews when they cross the line and reality shows do not face the same consequences	other shows are held accountable via ratings and reviews when they cross the line, reality shows face the same consequences	0	Criticism needs to be strongly raised when a reality show is sexist, racist, or misogynistic.	Reality shows are worse than other TV	Are Reality Shows Worse Than Other TV?	Is a bad reality show worse than a bad sit-com? Is a compelling one less important than a compelling scripted drama?
12629542_220_A1CF6U3GF7DZEJ	we need the islamists as scapegoats to unify the country	we do not need the islamists as scapegoats to unify the country	1	Working with Assad will help defeat radical islamists	The U.S. should work with Assad to fight ISIS	Should the U.S. Work With Assad to Fight ISIS?	Is the militant group such a threat to the United States that working with the despised Syrian dictator would be in the national interest?
3647415_356_A3TKD7EJ6BM0M5	cost saving methods make education available to everyone	cost saving methods can't make education available to everyone	1	Online courses should only be used as a low quality cost savings measure.	Online classes are not the best way to teach	Can Young Students Learn From Online Classes?	Online courses are increasingly common in high schools and middle schools. Is this the best way to teach that age group?
11163402_303_A34QZDSTKZ3JO9	people want the police to know their information	people don't want the police to know their information	0	Giving all immigrants ID cards would allow police to get information about people from their home country.	All immigrants should get ID cards	Should All Immigrants Get ID Cards?	Should cities issue identification for anyone who has no passport or driver's license, even if they are not in the country legally?
4803078_343_A1DJNUJZN8FE7N	I believe the Euro cannot handle it	I believe the Euro can handle it	0	Greece cannot support its own economy and is bringing the Euro down.	Greece will destroy the Euro Zone	Will Greece Destroy the Euro Zone?	The collapse of the Papandreou government may undo European efforts to restructure debt and hold the union together.
6210543_90_A3TKD7EJ6BM0M5	we can't have citizens being loyal to their home country	we can have citizens being loyal to their home country	1	America has more opportunity, but people are still loyal to their homes.	Dual citizenship should be allowed	Can Dual Citizens Be Good Americans?	Should dual citizenship be allowed? The pros and cons of pledging allegiance to more than one country.
8892337_0_AA7ASGQEOMKEZ	facts and actual use are more important than base sentimentality	facts and actual use are less important than base sentimentality	1	I have poor handwriting and  mainly use technology but cursive writing still feels important to me.	Students should be taught cursive	Is Cursive Dead?	New public school curriculum standards in the U.S. do not require the teaching of cursive. But should students be taught it anyway?
12628825_223_A1DJNUJZN8FE7N	Assad is half Kurdish on his mother's side	Assad is only half Kurdish on his mother's side and not a true Kurd	1	The U.S. should support the Kurds only.	The U.S. should not work with Assad to fight ISIS	Should the U.S. Work With Assad to Fight ISIS?	Is the militant group such a threat to the United States that working with the despised Syrian dictator would be in the national interest?
7951620_161_A1I4CYG5YDFTYM	there are regular city meetings to bring the community together as well as numerous events	there are not regular city meetings to bring the community together nor are there numerous events	1	The library brings community together as a center for development.	We need libraries	Do We Still Need Libraries?	What are libraries for, and how should they evolve?
10944255_438_A1DJNUJZN8FE7N	they seem to be regulating the government well enough	they don't seem to be regulating themselves well enough	1	The government is regulated by banks and corporations instead of governments actually regulating banks.	Big banks are out of control	Are Big Banks Out of Control?	Does the lack of legal compliance that have cost banks billions in fines show that some have gotten too big to manage properly?
7951577_328_A1I4CYG5YDFTYM	churches and other buildings offer the same things and the internet is full of free information	churches and other buildings don't offer the same things and the internet is full of free information	1	My library has many kinds of learning available and provides a community space for everyone, which I love.	We need libraries	Do We Still Need Libraries?	What are libraries for, and how should they evolve?
5449342_67_A1HKYY6XI2OHO1	we don't need to keep some groups in their place socially	we should keep some groups in their place socially	0	Social mobility is stifled by unpaid internships.	Unpaid internship exploit college students	Do Unpaid Internships Exploit College Students?	Should the government get tough to protect unpaid interns, or are internships a win-win?
7528221_101_A104V8NZIQFN2F	there is a way locals can do everything	there is no way locals can do everything	0	Disasters are locally handled by officials and neighbors.	We don't need FEMA	Do We Really Need FEMA?	Should the states, or private companies, take over FEMA's responsibilities for emergency response.
10100991_0_A104V8NZIQFN2F	I detest high deductibles because I often use my insurance	I prefer high deductibles because I don't use my insurance	0	Obamacare used low rates as a shell game to hide high deductibles and co-pays.	Obamacare is not working	Is Obamacare Working?	The law is starting to take effect. Were the dire predictions correct, or is it lowering costs and expanding access?
5445948_0_A1I4CYG5YDFTYM	it gives you fear of losing your job	it gives training on the job while not fearing losing your job	0	Unpaid interns are not just looking to gain experience.	Unpaid internship exploit college students	Do Unpaid Internships Exploit College Students?	Should the government get tough to protect unpaid interns, or are internships a win-win?
9312264_156_A1I4CYG5YDFTYM	this is fair because people will not be too picky or judgmental to offer a fair tip	this is unfair because people could be too picky or judgmental to offer a fair tip	0	Diners may not be able to select the server, but they can compensate them according to their service.	To tip	To Tip or Not to Tip	Should restaurants do away with tipping?
5612224_338_A1CF6U3GF7DZEJ	common sense has been in short supply since Eve	common sense has not been in short supply since Eve	1	People today lack common sense that cannot be taught.	People are getting dumber	Are People Getting Dumber?	Sometimes when you turn on the TV, it's hard not to wonder: Is humanity devolving?
5518992_364_A34QZDSTKZ3JO9	even people without children pay the taxes	even though people without children pay the taxes too	1	They have paid for the right through taxes and deserve the chance to further their athletic abilities.	Home-schoolers should play for high school teams	Should Home-Schoolers Play for High School Teams?	Home-schoolers may not want their children in the classroom but they'd like to see them on the football field. Is that their right?
7952064_230_A34QZDSTKZ3JO9	people don't need to be social to read	some people need to be social to read	1	Some people like a social place to read.	We need libraries	Do We Still Need Libraries?	What are libraries for, and how should they evolve?
6032130_73_A1I4CYG5YDFTYM	there is a large supply of information available online that anyone and everyone can access	there isn't a large supply of information available online that anyone and everyone can access	1	Some kids are not taught by parents how to cook, and many schools have done away with home economics in favor of science and math.	We need more advice about eating well	Do We Need More Advice About Eating Well?	Maybe Americans would be healthier if we understood nutrition better. Or maybe we know enough, and eat poorly for other reasons.
9863387_192_APW9F8OTJ4KXO	living on campus provides experience that allows for social and personal growth that just isn't obtained by living off campus	living on campus doesn't provide any additional experience that allows for social and personal growth	1	Most Americans live within commuting distance of universities.	Students should live off campus	Should Students Live on Campus or Off?	Is living in a dormitory worth the expense? Does living elsewhere mean missing out on the "college experience"?
11526420_122_APW9F8OTJ4KXO	apps are dependable and the best course of action is not to have a stenographer with an app used as backup	apps alone are not dependable and the best course of action is to have a stenographer with an app used as backup	0	Stenographers' work can be put into an app.	Court stenographers are not necessary	Are Court Stenographers Necessary?	After a New York court reporter left behind an incomplete record, some are asking whether it still makes sense to use stenographers in legal proceedings.
12408129_0_AE861G0AY5RGT	the residents of the Broken windows policing feel their quality of life is improving	the residents of the Broken windows policing feel their quality of life is being lowered	0	Broken windows policing saves money and increases quality of life, a powerful achievement.	Strictly enforcing minor violations deter more serious crime	Is 'Broken Windows' a Broken Policy for Police?	Does strictly enforcing minor violations deter more serious crime or simply harass and antagonize residents of high-crime neighborhoods?
9830834_412_APW9F8OTJ4KXO	it is the place of the US to be the watchdog of the world when plenty of our own are being mistreated	it is not the place of the US to be the watchdog of the world when plenty of our own are being mistreated	0	Syria has hurt its own people and it should be addressed.	US should attack Syria	Is an Attack on Syria Justified?	Should the United States and its allies launch air strikes against Syria in response to the Assad regime's reported use of chemical weapons?
8841900_282_A1CF6U3GF7DZEJ	NATO only looks good on paper	NATO looks good on paper	0	NATO is an organization without a purpose.	We should disband NATO	Has NATO Outlived Its Usefulness?	With the Soviet Union gone and austerity challenging security, should we disband NATO?
8834740_580_A1HKYY6XI2OHO1	high tuition doesn't always mean more money to pay professors	high tuition means more money to pay professors, especially ones using Crowdsource platforms to do research	0	College sports make tuition higher.	Drop sports program in undergraduate schools	Dropping the Ball	Should more undergraduate schools follow in the footsteps of Spelman College and consider dropping intercollegiate sports programs?
5448130_383_AB98SGS280TY5	Unpaid internships need to be regulated.	Unpaid internships are insufficiently regulated.	1	Internships are abused by employers and they should be monitored for misuse.	Unpaid internship exploit college students	Do Unpaid Internships Exploit College Students?	Should the government get tough to protect unpaid interns, or are internships a win-win?
10338783_127_A34QZDSTKZ3JO9	everyone lies at times	officers lie at times	1	Police officers are occasionally untruthful or falsify evidence.	Police officers should be required to wear cameras	If Police Encounters Were Filmed	Should police officers be required to wear cameras that record their interactions with the public?
4062498_218_A247LJDZOGXJK6	the internet offers teachers all the resources they could need	the internet doesn't offer teachers all the resources they could need	1	Librarians ensure teachers have the necessary resources.	School librarians are not expendable	Are School Librarians Expendable?	States and cities are under severe budget constraints. They are turning to the library.
5907773_300_A1DJNUJZN8FE7N	wasting money is a great way to help the economy	wasting money is a great way to hurt the economy	1	Hosting the Olympics is a waste of money.	Olympics are more trouble	Are the Olympics More Trouble Than They're Worth?	London and Rio de Janeiro saw the Games as an opportunity. But will the cities change for the better, and at what cost?
