#id	warrant0	warrant1	correctLabelW0orW1	reason	claim	debateTitle	debateInfo
7010246_188_A1HKYY6XI2OHO1	there are few enough TFA teachers that their inexperience isn't detrimental to students	there aren't enough TFA teachers	1	TFA teachers never gain enough experience to be helpful.	TFA is not working	Is Teach for America Working?	Has bringing in smart, young college graduates improved the education that American children are receiving?
5615055_0_A2QVMCGDLTWV9	intelligence is inherent and immutable	intelligence is affected by how informed you are	1	We are less informed and aren't motivated to be informed.	People are getting dumber	Are People Getting Dumber?	Sometimes when you turn on the TV, it's hard not to wonder: Is humanity devolving?
9975147_345_A138BU1VWM2RKN	most contestants go to college	most contestants don't go to college anyway	0	Miss America gives honors and education scholarships.	Miss America is good for women	There She Is, Miss America	In 1968, feminists gathered in Atlantic City to protest the Miss America pageant, calling it racist and sexist. Is this beauty contest bad for women?
2655497_381_A1I4CYG5YDFTYM	this is a hurdle the companies can get over, it appears there are ways to bring the cost down	this doesn't seem to be a hurdle the companies can get over, it seems to be costly no matter what they do	0	The future is an opportunity for electric car success if battery costs go down.	Electric cars will succeed	Will Electric Cars Finally Succeed?	Are plug-in cars the future, or will high cost and other technologies eclipse their promise?
3125041_388_AE861G0AY5RGT	the bike lanes cross pedestrian lanes	the bike lanes don't cross pedestrian lanes	0	People are crossing the street and not looking for traffic in the bike lane.	New York's bike lanes are not working	Are New York's Bike Lanes Working?	Mayor Koch's bicycle network died quickly. Mayor Bloomberg's is remaking the streets of the city. What is the verdict so far?
12004909_78_A104V8NZIQFN2F	most businesses offer the time restriction or compensation	businesses do not offer the time restriction or compensation	0	If it is a time restricted noncompete with provisions for compensation for employment restrictions.	Businesses should be allowed to have new employees sign noncompete deals	When Companies Close Doors to the Future	Should businesses be allowed to have new employees sign noncompete deals, agreeing to not to work for competitors?
6024130_356_A34QZDSTKZ3JO9	humans will evolve to survive even with the diet	humans will not evolve to survive even with the diet	1	A vegan diet goes against human evolution.	Veganism is not good for everyone	Is Veganism Good For Everyone?	Maybe some of us simply weren't built to be vegans. Is the diet good for everyone?
4427401_711_AE861G0AY5RGT	students can learn to write papers without the chore of research papers	students cannot learn to write papers without the chore of research papers	1	The students will need to learn how to perform college work and write a serious paper.	Research papers are a useful exercise for college students	Are Research Papers a Waste of Time?	Has the Internet made research papers a useless exercise for college students? Is there a better way to assess knowledge?
8692446_231_A3GNQDFPZALU92	more money means less desperation and need for money, therefore less likelihood of committing criminal acts	more money means more desperation and desire for money, therefore more likelihood of committing criminal acts	1	People have basic human weaknesses like greed regardless of how much money they have.	Rich politicans are not less corruptible	Are Rich Politicians Less Corruptible?	People often talk about "out of touch" billionaires running for office, but could they be less susceptible to bribes?
2323205_193_A1HKYY6XI2OHO1	people gambling will have much less money to pay taxes to fund the government's counteraction	people gambling will have much more money to pay taxes to fund the government's counteraction	0	The health issues that accompany gambling would necessitate the government to spend money to counteract them.	Internet gambling should not be legalized	Should Internet Gambling Be Legalized?	The potential boon for cash-strapped states versus the social costs associated with addiction.
8841921_0_A3TKD7EJ6BM0M5	peace is not prosperous for any economy	peace is prosperous for any economy	1	NATO has helped us keep peace since the Cold War.	We should keep NATO	Has NATO Outlived Its Usefulness?	With the Soviet Union gone and austerity challenging security, should we disband NATO?
12014627_104_A104V8NZIQFN2F	good reviews lead to tenure	good reviews do not lead to tenure	1	Teachers are safe from review.	Tenure protects bad teachers	Does Tenure Protect Bad Teachers or Good Schools?	Do job protections prevent bad faculty from being removed or do they provide for greater stability in a demanding, low-paid profession?
2698806_141_A1I4CYG5YDFTYM	they are used in most jobs and in many peoples adult lives	they are not used in most jobs or in many peoples adult lives	0	The humanities are vital to a broad and professional education.	Colleges need humanities programs	Do Colleges Need French Departments?	With humanities programs being cut at many universities, what do students stand to lose?
6032130_279_AYFOAD75CRBKE	there are many resources out there	there are not enough resources out there	1	The ability to get food outside the home with ease over the last 40 year, requires us to need more advice about eating well.	We need more advice about eating well	Do We Need More Advice About Eating Well?	Maybe Americans would be healthier if we understood nutrition better. Or maybe we know enough, and eat poorly for other reasons.
6947879_98_AYFOAD75CRBKE	we can stop the violence	we cannot stop the violence	1	The Israelis are now harming and oppressing the Palestinians which shouldn't be tolerated.	Supporting Israel hurts	Has Support for Israel Hurt U.S. Credibility?	Is support for Israel so entrenched in American politics that the U.S. has lost credibility and influence in the Middle East?
11540283_213_A34QZDSTKZ3JO9	treasures are only treasures if people see them as such	treasures are valuable	1	The Rock Hall of Fame is a house of treasures.	Rock Hall of Fame matters	Does the Rock Hall of Fame Matter?	Amid the usual debate about who belongs in the Hall of Fame and who gets to decide, why should music lovers care?
13563613_293_A1I4CYG5YDFTYM	these students rarely create problematic learning atmospheres and hinder other students	these students often create problematic learning atmospheres and hinder other students	0	Charter schools getting rid of problem students creates more problems.	Charter schools are cherry-picking students	Keeping Only the Best Behaved	Are charter schools, with their high rates of suspension and expulsion, cherry-picking students?
2699104_481_A1FBBY2JJYRMRI	Different and creative thinking isn't important.	Different and creative thinking is important.	1	Humanities programs make people think differently and more creatively.	Colleges need humanities programs	Do Colleges Need French Departments?	With humanities programs being cut at many universities, what do students stand to lose?
11408162_382_APW9F8OTJ4KXO	homeopathy is going to help those with polio or measles and those who are allergic cannot get exemptions	homeopathy is not going to do anything for polio or measles and those who are allergic can get exemptions	0	There can be allergies, and homeopathy is a better alternative.	Vaccination should not be mandatory for all children	Making Vaccination Mandatory for All Children	Should parents no longer be allowed to get religious or philosophical exemptions from having their children immunized?
11523833_166_A1CF6U3GF7DZEJ	iPhones do not	so do iPhones	0	They keep good records.	Court stenographers are necessary	Are Court Stenographers Necessary?	After a New York court reporter left behind an incomplete record, some are asking whether it still makes sense to use stenographers in legal proceedings.
7057234_301_A1I4CYG5YDFTYM	they have personal opinions that won't sway how the actual candidate thinks	they have personal opinions that can sway how the actual candidate thinks	0	The spouse of the candidate is not being elected and will have no official role in the administration.	We don't need to hear from candidate's spouse	Do We Need to Hear From the Candidate's Spouse?	What role should spouses of the nominees play at conventions? Is it appropriate (or useful) for them to give speeches?
8835695_451_A34QZDSTKZ3JO9	the programs don't give money to the education	the programs give money to the education	1	These programs bring lots of revenue, which all of the other activities of a University simply don't. No taxpayers in this country are willing to support the education of other peoples children.	Do not drop sports program in undergraduate schools	Dropping the Ball	Should more undergraduate schools follow in the footsteps of Spelman College and consider dropping intercollegiate sports programs?
9306087_441_A1HKYY6XI2OHO1	the owners took all the risk in the first place	the owners did not take all the risk in the first place	1	Restaurant owners benefit at the detriment of workers.	Not to tip	To Tip or Not to Tip	Should restaurants do away with tipping?
2700862_407_AE861G0AY5RGT	science and humanities are essential fields of study	science is an essential field of study, and humanities are completely optional	0	Humanities and the sciences are complementary disciplines.	Colleges need humanities programs	Do Colleges Need French Departments?	With humanities programs being cut at many universities, what do students stand to lose?
3639835_338_AA7ASGQEOMKEZ	interest in profits increases motivation and drives innovation	interest in profits decreases motivation and does not drive innovation	1	The only interest of the private sector is the bottom line profits.	Privatization is a bad deal for cities and states	Is Privatization a Bad Deal for Cities and States?	To save money, New York is turning the clock back on outsourcing by replacing private contractors with city workers.
2326100_179_A1I4CYG5YDFTYM	this would be easy to falsify	this wouldn't be easy to falsify	1	Gambling can be regulated through the use of a universal ID.	Internet gambling should be legalized	Should Internet Gambling Be Legalized?	The potential boon for cash-strapped states versus the social costs associated with addiction.
11163402_167_A1DJNUJZN8FE7N	identifying people is the only fun part of a police officers job	identifying people is the goal of a police officers job	1	Legal identification would help police identify people.	All immigrants should get ID cards	Should All Immigrants Get ID Cards?	Should cities issue identification for anyone who has no passport or driver's license, even if they are not in the country legally?
2698806_141_A1HKYY6XI2OHO1	students have gotten so much broad education already in primary school	students have not gotten  much broad education in primary school	1	The humanities are vital to a broad and professional education.	Colleges need humanities programs	Do Colleges Need French Departments?	With humanities programs being cut at many universities, what do students stand to lose?
7956728_349_A1I4CYG5YDFTYM	these things are all available online and most times for free, everyone has a cell phone and wifi is free in many public locaitons	these things aren't all available online and most times for free, and not everyone has a cell phone	1	Public Libraries are good for those less fortunate, providing a nearly free source of different media's.	We need libraries	Do We Still Need Libraries?	What are libraries for, and how should they evolve?
13657334_0_A104V8NZIQFN2F	corruption is not the best way to infiltrate a foreign government	corruption is the best way to infiltrate a foreign government	0	The CIA is too large and corrupt to be reformed.	We don't need the C.I.A.	Do We Need the C.I.A.?	Would the security needs of the United States be better served if the agency were dismantled?
7950969_0_A1LZPWVZRTUZD0	services for the homeless can't be administered more efficiently and effectively through a local social service center	services for the homeless can be administered more efficiently and effectively through a local social service center	0	Libraries provide help for the homeless, including temporary shelter and career resources.	We need libraries	Do We Still Need Libraries?	What are libraries for, and how should they evolve?
6006832_47_A34QZDSTKZ3JO9	most people have the internet	not everyone has the internet	0	The internet contains sufficient nutrition information.	We do not need more advice about eating well	Do We Need More Advice About Eating Well?	Maybe Americans would be healthier if we understood nutrition better. Or maybe we know enough, and eat poorly for other reasons.
9047310_65_A247LJDZOGXJK6	the harder the game is the more interesting it is to watch	the harder the game is the less interesting it is to watch	1	Dunks are still difficult to achieve given the defenses most teams now use.	Rim should not be raised	Raise the Rim?	Many basketball players today are a foot taller than players were in the 1800s; the rim is no longer out of reach. Should it be raised?
9848910_0_A1DJNUJZN8FE7N	5 years is a lot of time spent in the classroom	5 years is practically nothing	0	It took me 5 years to become a good teacher.	Teachers need to have experience	Do Teachers Need to Have Experience?	Many charter schools rely on young inexperienced, but motivated, people who quit after a few years. Is that a good idea?
2261238_0_A1I4CYG5YDFTYM	those class benefits exist and are better than other methods	those class benefits rarely exist and are not better than other methods	1	TFA does not help public school teachers as a whole, there are some passing benefits for a class or two but it makes me wonder about the students not in those classes or the school itself benefiting.	TFA has not raised the status of teachers	Teaching: The Passion and the Profession	Has Teach for America raised the status of public school teachers?
5445948_346_A2QVMCGDLTWV9	the money saved does not go to improving internship experiences for college students	the money saved goes to improving internship experiences for college students	0	It is just a way for companies to save money.	Unpaid internship exploit college students	Do Unpaid Internships Exploit College Students?	Should the government get tough to protect unpaid interns, or are internships a win-win?
6953351_131_A104V8NZIQFN2F	Isreal should give those nuclear weapons to their enemy at the end of a cruise missle	Isreal might give those nuclear weapons to their enemy at the end of a cruise missle	1	As a nation, it is well known that Israel has a stockpile of nuclear weapons that they should be forced to give up.	Supporting Israel hurts	Has Support for Israel Hurt U.S. Credibility?	Is support for Israel so entrenched in American politics that the U.S. has lost credibility and influence in the Middle East?
5449542_0_A34QZDSTKZ3JO9	interns will have a chance to earn a real job	interns will not have a chance to earn a real job	1	Internships should be treated like all other work.	Unpaid internship exploit college students	Do Unpaid Internships Exploit College Students?	Should the government get tough to protect unpaid interns, or are internships a win-win?
9311766_52_A2G30CUMM6UXG5	it's their job to serve the food in a pleasant way no matter what	it's their job to serve the food in a pleasant way if customers tip	1	Tipping servers provides an added incentive to create a pleasant environment for the customers.	To tip	To Tip or Not to Tip	Should restaurants do away with tipping?
13038883_165_A3C9GGDXBZW62D	the Cold War was a worse  era	the Cold War was a better era	0	The sanctions are leftover from the Cold War, a different era of thinking.	The U.S. should lift sanctions with Cuba	Hitting 'Restart' With Cuba	Should the U.S. lift sanctions and establish diplomatic relations with Cuba?
6131389_93_A1CF6U3GF7DZEJ	omnivores are not doomed to extinction and are healthy	omnivores are doomed to extinction because of health risks	0	Human bodies are designed as omnivores.	Veganism is not good for everyone	Is Veganism Good For Everyone?	Maybe some of us simply weren't built to be vegans. Is the diet good for everyone?
11163402_303_A2OZTBCBOCHF9E	Police need information	Police don't need information	0	Giving all immigrants ID cards would allow police to get information about people from their home country.	All immigrants should get ID cards	Should All Immigrants Get ID Cards?	Should cities issue identification for anyone who has no passport or driver's license, even if they are not in the country legally?
2699711_361_AE861G0AY5RGT	only essential information needs to be provided to students	all information, essential or not, needs to be provided to students	0	Humanities programs teach non-essential information.	Colleges do not need humanities programs	Do Colleges Need French Departments?	With humanities programs being cut at many universities, what do students stand to lose?
5378052_185_A34QZDSTKZ3JO9	too many people would use the rail, it would be congested	enough people would use the rail to justify its cost	1	The rail is much safer.	California needs high-speed rail	Does California Need High-Speed Rail?	Some say the state can't afford to build a rail line from Los Angeles to San Francisco. But maybe it can't afford not to.
5350361_272_A104V8NZIQFN2F	parents may not have those options available to them	parents have those options available to them	1	Parents are welcome to home school or find a school that teaches as they approve instead of dictating public school teaching.	Parents should not control what kids learn at school	Should Parents Control What Kids Learn at School?	In New Hampshire, parents can tailor each child's curriculum to avoid "objectionable" content. Does that turn education into a private right instead of a public good?
8828991_217_A3TKD7EJ6BM0M5	competition in the business world is a negative	competition in the business world is a positive	1	Highly competitive sports helps you learn to compete in the business world. Far more than those who have never been part of competitive sports can understand.	Do not drop sports program in undergraduate schools	Dropping the Ball	Should more undergraduate schools follow in the footsteps of Spelman College and consider dropping intercollegiate sports programs?
9950396_0_A1I4CYG5YDFTYM	the chef has seasoned the dish to taste exactly as they envisioned	the chef has not always seasoned the dish to taste exactly as they envisioned	1	The chef can't know how each person wants their food seasoned.	Salt should have a place at the table	Should Salt Have a Place at the Table?	More restaurants have been doing without salt shakers. Some chefs say that's sensible. Some diners find it annoying.
5518992_364_A1CF6U3GF7DZEJ	they freely chose to forego the tax benefits of public education	they freely chose not to forego the tax benefits of public education	1	They have paid for the right through taxes and deserve the chance to further their athletic abilities.	Home-schoolers should play for high school teams	Should Home-Schoolers Play for High School Teams?	Home-schoolers may not want their children in the classroom but they'd like to see them on the football field. Is that their right?
12016993_732_AYFOAD75CRBKE	new teachers method may not work	old teachers method may not work	0	Older teacher taught new one discipline and techniques.	Tenure provides stability	Does Tenure Protect Bad Teachers or Good Schools?	Do job protections prevent bad faculty from being removed or do they provide for greater stability in a demanding, low-paid profession?
12010736_0_AE861G0AY5RGT	the US is not concerned with competing with Russia	the US is concerned with competing with Russia	1	These agreements put this country behind Czarist Russia in regards to our work force.	Businesses should not be allowed to have new employees sign noncompete deals	When Companies Close Doors to the Future	Should businesses be allowed to have new employees sign noncompete deals, agreeing to not to work for competitors?
7951620_0_APW9F8OTJ4KXO	these activities are fun, but not vital to a community	these activities are fun and vital to the community	1	Libraries have many events and activities as well as expert staff which play a vital role in the community.	We need libraries	Do We Still Need Libraries?	What are libraries for, and how should they evolve?
7327906_793_A3PILUAB7LZGWQ	people really don't have within themselves the deep knowledge of right and wrong	people really have within themselves the deep knowledge of right and wrong	0	Professional critics shed light to things that would otherwise be missed, make people question things, and think harder about things.	We need professional critics	Do We Need Professional Critics?	Can professional criticism stay relevant in a media landscape overflowing with opinions?
9561738_375_A34QZDSTKZ3JO9	the queen has done a lot for her country already	the queen has still a lot to do for her country	1	Having lived through some of the more catastrophic changes on this planet, political as well as economic. Having made some very tough decisions, which impact millions of people...Her Royal Highness, has probably, more wisdom than all journalists combined.	Queen Elizabeth II should not step down	Should Queen Elizabeth II Step Down?	As the British royal family welcomes the third in line to the throne, is it time for the House of Windsor to consider a retirement policy?
9952772_729_A3TKD7EJ6BM0M5	food tasting better will make people overeat	food tasting better will make people enjoy their food and eat less	1	Salt makes food taste better.	Salt should have a place at the table	Should Salt Have a Place at the Table?	More restaurants have been doing without salt shakers. Some chefs say that's sensible. Some diners find it annoying.
3173925_242_A1I4CYG5YDFTYM	home schoolers are simply an alternative to public school and deserve some sort of financial help to help students get educated	home schoolers are not simply an alternative to public school and don't deserve some sort of  financial help to help students get educated	1	All people must be responsible for funding public schools with tax money in my opinion.	Home schoolers do not deserve a tax break	Do Home Schoolers Deserve a Tax Break?	Some conservatives want a federal credit for families who teach their children at home. What are its chances in the new Congress?
11650201_63_A104V8NZIQFN2F	destroying Israel isn't the way to go	destroying Israel is the way to go	0	Arabs main goal is to destroy Israel.	Hamas-Fatah unity can't lead to mideast peace	Can Hamas-Fatah Unity Lead to Mideast Peace?	Will a reconciliation between Fatah and Hamas improve the chances of Arab-Israeli peace, which have dimmed as U.S.-backed talks foundered?
3234363_899_A1CF6U3GF7DZEJ	human nature excels only under pressure	human nature won't excel under pressure	1	Forcing a poet to practice science does not produce a top notch scientist but fine tuning literary skills can make a great poet or literary artist.	Extreme parenting is counterproductive	Is Extreme Parenting Effective?	Does strict control of a child's life lead to greater success or can it be counterproductive?
5907773_300_A34QZDSTKZ3JO9	the people that travel there are not only rich tourists	the only people that travel there are rich tourists	0	Hosting the Olympics is a waste of money.	Olympics are more trouble	Are the Olympics More Trouble Than They're Worth?	London and Rio de Janeiro saw the Games as an opportunity. But will the cities change for the better, and at what cost?
9952573_220_A1DJNUJZN8FE7N	most people can exercise moderate control	most people can't exercise moderate control	0	Salt shakers permit diners to control the amount of salt in their food.	Salt should have a place at the table	Should Salt Have a Place at the Table?	More restaurants have been doing without salt shakers. Some chefs say that's sensible. Some diners find it annoying.
9043593_0_A104V8NZIQFN2F	the NBA will be fun to watch	the NBA was never that fun to watch anyway	0	The slam dunk has lessened the attraction of watching an NBA game.	Rim should be raised	Raise the Rim?	Many basketball players today are a foot taller than players were in the 1800s; the rim is no longer out of reach. Should it be raised?
9846734_289_AE861G0AY5RGT	zest isn't as important as being knowledgeable	zest is just as important as being knowledgeable	1	Experienced teachers lose their zest by the 6th or 7th year.	Teachers do not need to have experience	Do Teachers Need to Have Experience?	Many charter schools rely on young inexperienced, but motivated, people who quit after a few years. Is that a good idea?
9863387_192_A1HKYY6XI2OHO1	many students get distracted when needing to commute even short distances	many students don't get distracted when needing to commute	1	Most Americans live within commuting distance of universities.	Students should live off campus	Should Students Live on Campus or Off?	Is living in a dormitory worth the expense? Does living elsewhere mean missing out on the "college experience"?
5477994_372_A1HKYY6XI2OHO1	sports is a part of education	sports isn't a part of education	0	Those choosing to home school should not be allowed to just take what they want from public education.	Home-schoolers should not play for high school teams	Should Home-Schoolers Play for High School Teams?	Home-schoolers may not want their children in the classroom but they'd like to see them on the football field. Is that their right?
