#id	warrant0	warrant1	correctLabelW0orW1	reason	claim	debateTitle	debateInfo
5445924_630_A2JKETV64OU7DY	it puts students on the bottom rung in the workplace	it teaches a lesson of how it feels to be on the bottom rung in the workplace.	0	Unpaid internships take advantage of students by requiring them to work long an hard for work experience and no paycheck.	Unpaid internship exploit college students	Do Unpaid Internships Exploit College Students?	Should the government get tough to protect unpaid interns, or are internships a win-win?
6017135_17_A1CF6U3GF7DZEJ	such children will still survive, although a little shorter	such children will be deprived of needed nutrition	1	Children can't thrive as vegans and require a diet containing animal products.	Veganism is not good for everyone	Is Veganism Good For Everyone?	Maybe some of us simply weren't built to be vegans. Is the diet good for everyone?
3235190_0_A247LJDZOGXJK6	compassionate adults are often more successful than their peers	compassionate adults are often less successful than their peers	0	Extreme parenting doesn't necessarily raise a compassionate child.	Extreme parenting is counterproductive	Is Extreme Parenting Effective?	Does strict control of a child's life lead to greater success or can it be counterproductive?
2700850_116_A104V8NZIQFN2F	humanities programs are conventional wisdom	humanities programs are unconventional wisdom	1	Students need to think critically and outside of conventional ideas.	Colleges need humanities programs	Do Colleges Need French Departments?	With humanities programs being cut at many universities, what do students stand to lose?
4062443_409_A1I4CYG5YDFTYM	that cost can't be reduced with the technology we have	that cost could be reduced greatly with newer advancements in technology and a proper database	0	The costs to replace school librarians with technology is prohibitive.	School librarians are not expendable	Are School Librarians Expendable?	States and cities are under severe budget constraints. They are turning to the library.
9953248_133_A1I4CYG5YDFTYM	the chef doesn't season the dish before it is served	the chef does that to the dish before it is served	0	Anyone is more than welcome to add wanted salt to their food.	Salt should have a place at the table	Should Salt Have a Place at the Table?	More restaurants have been doing without salt shakers. Some chefs say that's sensible. Some diners find it annoying.
4845332_217_A1I4CYG5YDFTYM	the US runs on a similar system and foundation that provides the same amount of freedom as Australia	the US runs on a different system and foundation that provides more freedom, this would not be freedom	0	It works for Australia.	Voting should be mandatory	Should Voting Be Mandatory?	Or are there already too many people casting ballots?
9305215_426_A1I4CYG5YDFTYM	people will be paying more for dishes	people won't be willing to pay more for dishes	0	I want to Increase the price of menu items to pay waitstaff higher wages.	Not to tip	To Tip or Not to Tip	Should restaurants do away with tipping?
5480877_361_AYFOAD75CRBKE	the parents can't pay a fee	the parents can pay a fee	0	Public schools earn their funding by the number of students who are actually enrolled, therefore, anyone who doesn't enroll should not get to use services paid for with that money.	Home-schoolers should not play for high school teams	Should Home-Schoolers Play for High School Teams?	Home-schoolers may not want their children in the classroom but they'd like to see them on the football field. Is that their right?
7545952_11_A34QZDSTKZ3JO9	people shouldn't watch reality shows as most people don't like them	people still watch reality shows even if they don't like them	0	Reality shows cause me to die a little whenever I see them advertised even though I have watched them at times.	Reality shows are worse than other TV	Are Reality Shows Worse Than Other TV?	Is a bad reality show worse than a bad sit-com? Is a compelling one less important than a compelling scripted drama?
8835812_0_A104V8NZIQFN2F	colleges don't always have classes that teach those qualities	colleges already have classes that teach those qualities	0	Sports programs teach important things like leadership, discipline, and teamwork.	Do not drop sports program in undergraduate schools	Dropping the Ball	Should more undergraduate schools follow in the footsteps of Spelman College and consider dropping intercollegiate sports programs?
6103587_0_A1DJNUJZN8FE7N	the public needs to be reminded that they don't come first	the public needs to be reminded that they come first	1	Banks are making big profits and forgetting to serve the public first.	Fees should be more regulated	Are Banks Making Too Much Money From Fees?	Do the fees banks charge customers need to be more closely regulated, or are they necessary for the health of the banks, and the economy?
3124188_800_A2QVMCGDLTWV9	Bike lanes cause a lot of accidents with pedestrians and street traffic.	Bike lanes do not cause a lot of accidents with pedestrians and street traffic.	1	The bike lanes are low cost and fast.	New York's bike lanes are working	Are New York's Bike Lanes Working?	Mayor Koch's bicycle network died quickly. Mayor Bloomberg's is remaking the streets of the city. What is the verdict so far?
3124932_0_A104V8NZIQFN2F	riding a bike to work makes you tired and ineffective	riding a bike to work makes you less tired and ineffective	1	Many people ride bikes to work.	New York's bike lanes are working	Are New York's Bike Lanes Working?	Mayor Koch's bicycle network died quickly. Mayor Bloomberg's is remaking the streets of the city. What is the verdict so far?
4964300_22_A34QZDSTKZ3JO9	employers won't hire the obese	employers will still hire the obese	1	It is unfair that employers must pay a penalty for hiring obese people.	Legislation should not protect obese	Should Legislation Protect the Obese?	Should it be illegal for businesses to discriminate against unhealthy and heavily overweight applicants?
7950152_326_A2GHGJP29KRWOQ	wise additions are not the governments forte'	wise additions are the governments forte'	1	Libraries are a wise addition.	We need libraries	Do We Still Need Libraries?	What are libraries for, and how should they evolve?
9952050_384_A1CF6U3GF7DZEJ	I can always go to another restaurant without having to carry my own salt	I can always go to another restaurant or carry my own salt	0	I should be able to decide how much salt I use.	Salt should have a place at the table	Should Salt Have a Place at the Table?	More restaurants have been doing without salt shakers. Some chefs say that's sensible. Some diners find it annoying.
9950119_108_A1DJNUJZN8FE7N	it shouldn't be the personal decision of the restaurant owner	it should also be the personal decision of the restaurant owner	0	Each person is unique and has their own specific tastes, it should be their personal decision.	Salt should have a place at the table	Should Salt Have a Place at the Table?	More restaurants have been doing without salt shakers. Some chefs say that's sensible. Some diners find it annoying.
6017135_17_A1I4CYG5YDFTYM	those vitamins and nutrients found in animal products can easily be found in supplements	those vitamins and nutrients found in animal products cannot easily be found in supplements	1	Children can't thrive as vegans and require a diet containing animal products.	Veganism is not good for everyone	Is Veganism Good For Everyone?	Maybe some of us simply weren't built to be vegans. Is the diet good for everyone?
5613711_180_A1CF6U3GF7DZEJ	they did in the past	they never did in the past	0	People are not using their intelligence to the best of his or her ability anymore.	People are getting dumber	Are People Getting Dumber?	Sometimes when you turn on the TV, it's hard not to wonder: Is humanity devolving?
2699822_167_A3TKD7EJ6BM0M5	humanities programs teach languages	humanities programs do not teach languages	0	Colleges need to ensure that opportunity to acquire language remains part of higher education.	Colleges need humanities programs	Do Colleges Need French Departments?	With humanities programs being cut at many universities, what do students stand to lose?
3651071_117_A1CF6U3GF7DZEJ	students are less comfortable because of these problems	students are more comfortable despite these problems	0	Often there are technical problems in online education platforms.	Online classes are not the best way to teach	Can Young Students Learn From Online Classes?	Online courses are increasingly common in high schools and middle schools. Is this the best way to teach that age group?
5612224_338_A2JKETV64OU7DY	there have not always been people who lack common sense in society.	there have always been people who lack common sense in society.	0	People today lack common sense that cannot be taught.	People are getting dumber	Are People Getting Dumber?	Sometimes when you turn on the TV, it's hard not to wonder: Is humanity devolving?
4063299_234_A34QZDSTKZ3JO9	school librarians don't work with the same people that public ones do	school librarians and public librarians work similarly with all people	1	Public librarians can be important to people's lives.	School librarians are not expendable	Are School Librarians Expendable?	States and cities are under severe budget constraints. They are turning to the library.
7968413_132_AYFOAD75CRBKE	it may create possibilities for other moments	it doesn't create possibilities for other moments	1	Private moments are now publicized where anybody can comment.	Social media ruin romance	Has Facebook Ruined Love?	Are tweets, status updates and tagged photographs encouraging romance or ruining it?
2699541_170_A1DJNUJZN8FE7N	wasting tax payer money is not an American tradition	wasting tax payer money is an American tradition	0	Humanities programs are a waste of taxpayer money with no result.	Colleges do not need humanities programs	Do Colleges Need French Departments?	With humanities programs being cut at many universities, what do students stand to lose?
10228010_216_A1I4CYG5YDFTYM	taxes and revenue generated from casinos could go towards education	taxes and revenue generated from casinos wouldn't go towards education	1	Allocating resources to education is more useful than funding casinos	Casinos are too much of a gamble	Are Casinos Too Much of a Gamble?	Do the economic and fiscal benefits of casinos outweigh their social and economic costs?
9043990_308_A1CF6U3GF7DZEJ	they really don't count in the equation	they count in the equation	1	High school players are often short, and would not want the rim raised.	Rim should not be raised	Raise the Rim?	Many basketball players today are a foot taller than players were in the 1800s; the rim is no longer out of reach. Should it be raised?
5446557_184_AE861G0AY5RGT	unpaid interns are not able to live rent free	unpaid interns are able to live rent free	0	Only people with money can afford to be unpaid interns since some people need to work to support them self or pay their loans.	Unpaid internship exploit college students	Do Unpaid Internships Exploit College Students?	Should the government get tough to protect unpaid interns, or are internships a win-win?
7644790_273_A1I4CYG5YDFTYM	they don't bring stability to the economy of Europe as well as not offer strong military backing if needed	they bring stability to the economy of Europe as well as offer strong military backing if needed	0	If they don't abandon the Euro they will be creating violence and loss of life.	Germany should abandon the Euro	Should Germany Abandon the Euro?	The repercussions of Greece leaving the euro zone have been widely debated. But what if Germany left instead?
5360372_635_A34QZDSTKZ3JO9	parents are in charge of their children's learning	parents are not in charge of their children's learning at school	1	Parents can choose what their kids learn at home.	Parents should not control what kids learn at school	Should Parents Control What Kids Learn at School?	In New Hampshire, parents can tailor each child's curriculum to avoid "objectionable" content. Does that turn education into a private right instead of a public good?
11900472_0_AE861G0AY5RGT	the current information is not useful we need a new way to judge colleges	the current information is not useful	1	The type of information reviewed is not useful enough.	Government should not grade colleges	Should the Government Grade Colleges?	Should the government rate colleges to hold them accountable for graduation rates, student debt and access for the poor and minorities?
12412641_198_APW9F8OTJ4KXO	small cities have the space or accommodations for large amounts of tourists	small cities do not have the space or accommodations for large amounts of tourists	0	A small city with architectural treasures can become an international destination for architecture aficionados.	'Starchitects' are not ruining cities	Are 'Starchitects' Ruining Cities?	Are superstar architects, who often work in cities they know little about, creating buildings that don't mesh well with the surroundings?
2700850_116_A1HKYY6XI2OHO1	critical thinking rarely leads to students protesting	critical thinking leads to students protesting	0	Students need to think critically and outside of conventional ideas.	Colleges need humanities programs	Do Colleges Need French Departments?	With humanities programs being cut at many universities, what do students stand to lose?
8828991_387_A1I4CYG5YDFTYM	these things can be taught through academic things	these things can't be taught through academic things	1	Sports programs teach competition and the will to succeed.	Do not drop sports program in undergraduate schools	Dropping the Ball	Should more undergraduate schools follow in the footsteps of Spelman College and consider dropping intercollegiate sports programs?
9853997_193_A1CF6U3GF7DZEJ	colleges do not need diversity in addition to community	colleges need diversity in addition to community	0	There is a community made in the dorms.	Students should live on campus	Should Students Live on Campus or Off?	Is living in a dormitory worth the expense? Does living elsewhere mean missing out on the "college experience"?
6104729_65_A3TKD7EJ6BM0M5	hidden fees can be asked about	hidden fees aren't revealed	1	Accounts should not be listed as free, when they include hidden fees.	Fees should be more regulated	Are Banks Making Too Much Money From Fees?	Do the fees banks charge customers need to be more closely regulated, or are they necessary for the health of the banks, and the economy?
7948914_704_AE861G0AY5RGT	not everyone can have a cell phone which has internet access	everyone can have a cell phone which has internet access	0	Libraries provides books and internet access to those who cannot afford it.	We need libraries	Do We Still Need Libraries?	What are libraries for, and how should they evolve?
9308914_360_A104V8NZIQFN2F	people should still incentivize their server	people shouldn't still incentivize their server	1	Wait staff should be taken care of by the restauranteur.	Not to tip	To Tip or Not to Tip	Should restaurants do away with tipping?
11408162_344_A247LJDZOGXJK6	children can make personal choices for themselves under the law	children can't make personal choices for themselves under the law	0	Vaccination should remain a personal choice.	Vaccination should not be mandatory for all children	Making Vaccination Mandatory for All Children	Should parents no longer be allowed to get religious or philosophical exemptions from having their children immunized?
2264065_190_APW9F8OTJ4KXO	the competition takes the focus away from the quality of the education	the competition doesn't take the focus away from the quality of the education	1	TFA has made teaching positions something that the best and brightest are in competition for.	TFA has raised the status of public teachers	Teaching: The Passion and the Profession	Has Teach for America raised the status of public school teachers?
4367042_282_A1CF6U3GF7DZEJ	they would not be willing to pay beyond a certain threshold	they would be willing to pay beyond a certain threshold	1	People would be willing to pay more money for produce picked by US citizens.	Farms could survive without illegal labor	Could Farms Survive Without Illegal Labor?	If American growers depend on illegal labor, would strict enforcement of immigration laws drive up prices for fruits and vegetables?
3638806_0_A34QZDSTKZ3JO9	people won't keep the best interest in mind	people will keep the best interest in mind	0	The people who want privatization do not have the cities and states best interests in mind.	Privatization is a bad deal for cities and states	Is Privatization a Bad Deal for Cities and States?	To save money, New York is turning the clock back on outsourcing by replacing private contractors with city workers.
4070387_142_A1LZPWVZRTUZD0	librarians have no expertise in helping students navigate the internet	librarians have vast expertise in helping students navigate the internet	1	The internet is full of things which can fool impressionable students, some learn easily, while other will be fooled.	School librarians are not expendable	Are School Librarians Expendable?	States and cities are under severe budget constraints. They are turning to the library.
7951380_271_AHQ90UG2T3KNB	there aren't many parks and churches that also provide peaceful environments while school is not in session.	there are many parks and churches that also provide peaceful environments while school is not in session.	0	When school is not in session, one can still gain knowledge and a peaceful environment in a library.	We need libraries	Do We Still Need Libraries?	What are libraries for, and how should they evolve?
5477731_899_A1I4CYG5YDFTYM	they do not lack a path to learn team building	they lack a path to learn team building	0	Home schoolers are not part of the community.	Home-schoolers should not play for high school teams	Should Home-Schoolers Play for High School Teams?	Home-schoolers may not want their children in the classroom but they'd like to see them on the football field. Is that their right?
11963803_459_A1I4CYG5YDFTYM	this won't open the door to people going on to harder drugs	this opens the door to people getting high and out of control and then going on to harder drugs	0	Most marijuana users aren't influenced by the ruling.	Colorado didn't go too far with pot	Did Colorado Go Too Far With Pot?	Was the move to legalize marijuana done too quickly? Do changes need to be made to their approach?
12538582_0_A1CF6U3GF7DZEJ	people eventually get over this frustration	people never get over this frustration	1	High tech devices only cause frustration.	3-D printing will not change the world	Will 3-D Printing Change the World?	For all the hype over three-dimensional printing, it's still unclear exactly how and when it will have an impact on our daily lives.
9831959_439_A34QZDSTKZ3JO9	what is going on in Syria is US's business	what is going on in Syria isn't US's business	1	Americans should mind their own business.	US should not attack Syria	Is an Attack on Syria Justified?	Should the United States and its allies launch air strikes against Syria in response to the Assad regime's reported use of chemical weapons?
6207424_320_APW9F8OTJ4KXO	one needs to have a true allegiance in order to have their tax responsibility enforced	one doesn't need to have true allegiance in order to have their tax responsibility enforced	0	Dual citizens do not have true allegiance to either country and get away without paying taxes.	Dual citizenship should not be allowed	Can Dual Citizens Be Good Americans?	Should dual citizenship be allowed? The pros and cons of pledging allegiance to more than one country.
4426679_112_A1I4CYG5YDFTYM	research is not used in very many fields of work so it is not an important skill for the majority of the populace	research is used in many fields of work so it is an important skill for the majority of the populace	1	Students must thoroughly process information to apply it towards their paper.	Research papers are a useful exercise for college students	Are Research Papers a Waste of Time?	Has the Internet made research papers a useless exercise for college students? Is there a better way to assess knowledge?
9043593_0_AE861G0AY5RGT	most players in the NBA are not able to dunk	most players in the NBA are able to dunk	1	The slam dunk has lessened the attraction of watching an NBA game.	Rim should be raised	Raise the Rim?	Many basketball players today are a foot taller than players were in the 1800s; the rim is no longer out of reach. Should it be raised?
12724989_0_A1HKYY6XI2OHO1	the lack of popularity of the leagues does not threaten to make them extinct	the lack of popularity of the leagues threaten to make them extinct	0	No one benefits from sports leagues.	Sport leagues should not enjoy nonprofit status	Tax Break for Sports	Should pro sports leagues enjoy nonprofit status?
7952064_230_A1LZPWVZRTUZD0	coffee shops do not provide a nicer and more economically sustainable social place to read	coffee shops provide a nicer and more economically sustainable social place to read	0	Some people like a social place to read.	We need libraries	Do We Still Need Libraries?	What are libraries for, and how should they evolve?
6210543_90_A104V8NZIQFN2F	you should be able to take advantage of American opportunity without loyalty to it	you shouldn't be able to take advantage of American opportunity without loyalty to it	0	America has more opportunity, but people are still loyal to their homes.	Dual citizenship should be allowed	Can Dual Citizens Be Good Americans?	Should dual citizenship be allowed? The pros and cons of pledging allegiance to more than one country.
3639142_81_A104V8NZIQFN2F	we can't replace the managers	we can at least replace the lazy workers	0	Privatization is not a cure for incompetent managers.	Privatization is a bad deal for cities and states	Is Privatization a Bad Deal for Cities and States?	To save money, New York is turning the clock back on outsourcing by replacing private contractors with city workers.
12536410_355_A34QZDSTKZ3JO9	some innovations are lost amongst others	some innovations stand out amongst others	1	3D printing allows for many innovations.	3-D printing will change the world	Will 3-D Printing Change the World?	For all the hype over three-dimensional printing, it's still unclear exactly how and when it will have an impact on our daily lives.
6953351_131_AA7ASGQEOMKEZ	we would rather they use those weapons on us	we would rather they not use those weapons on us	0	As a nation, it is well known that Israel has a stockpile of nuclear weapons that they should be forced to give up.	Supporting Israel hurts	Has Support for Israel Hurt U.S. Credibility?	Is support for Israel so entrenched in American politics that the U.S. has lost credibility and influence in the Middle East?
2341049_117_A104V8NZIQFN2F	Senoi Indians are a backwater culture	Senoi Indians are a trustworthy culture	1	Senoi Indians believe that our dream state is the other side of our wakeful state, and is of equal importance.	We should not manipulate our dreams	Should We Manipulate Our Dreams?	Nightmares have been seen variously as omens or sources of self-knowledge. Should we replace them with happier dreams?
4062498_730_AE861G0AY5RGT	the library is not used in modern times due to the proliferation of internet access on phones	the library is still used in modern times even with the proliferation of internet access on phones	1	A librarian can lead the school in information resource management and use.	School librarians are not expendable	Are School Librarians Expendable?	States and cities are under severe budget constraints. They are turning to the library.
10228010_74_AE861G0AY5RGT	the financial benefit of the community does not out weigh the social costs to the weak of mind	the financial benefit of the community out weigh the social costs to the weak of mind	0	Casinos bring uncalculated social costs.	Casinos are too much of a gamble	Are Casinos Too Much of a Gamble?	Do the economic and fiscal benefits of casinos outweigh their social and economic costs?
7237604_435_A1I4CYG5YDFTYM	they save the lives of military personnel so they don't have to send so many people into an extreme combat situation	they don't save the lives of military personnel so they have to send so many people into an extreme combat situation	1	Drone attacks are impersonal and indiscriminate of targets.	Drone attacks make more harm	Do Drone Attacks Do More Harm Than Good?	Strikes have fueled anti-American sentiment, but also have taken out some terrorist targets. Are they making the U.S. safer or just more hated?
3235492_212_A104V8NZIQFN2F	her grades went up	her grades went up she has been picked on at school	0	My daughter was simply lazy and not doing work, by cracking down I was able to get her to improve her grades.	Extreme parenting leads to greater success	Is Extreme Parenting Effective?	Does strict control of a child's life lead to greater success or can it be counterproductive?
11404235_186_AA7ASGQEOMKEZ	many need to be vaccinated to benefit from herd immunity	one does not need vaccinated to benefit from herd immunity	0	Herd immunity protects against those that cannot be vaccinated.	Vaccination should be mandatory for all children	Making Vaccination Mandatory for All Children	Should parents no longer be allowed to get religious or philosophical exemptions from having their children immunized?
4441037_436_A34QZDSTKZ3JO9	it takes critical thinking to write a paper	it takes too much thinking to write a paper	0	A well written paper takes critical thinking skills.	Research papers are a useful exercise for college students	Are Research Papers a Waste of Time?	Has the Internet made research papers a useless exercise for college students? Is there a better way to assess knowledge?
